{
  "schemaVersion": "1.3.0",
  "evidenceKind": "ProbabilisticCodexSkillBehaviorEvaluation",
  "evaluatorVersion": "1.0.0",
  "scoringContractVersion": "1.0.0",
  "configurationId": "fixture-behavior-evaluation",
  "configurationHash": "0000000000000000000000000000000000000000000000000000000000000000",
  "evaluatorHash": "0000000000000000000000000000000000000000000000000000000000000000",
  "persistenceBoundaryHash": "0000000000000000000000000000000000000000000000000000000000000000",
  "evaluatedInputHash": "1111111111111111111111111111111111111111111111111111111111111111",
  "corpusHash": "0000000000000000000000000000000000000000000000000000000000000000",
  "skillInputHash": "0000000000000000000000000000000000000000000000000000000000000000",
  "authorityHash": "0000000000000000000000000000000000000000000000000000000000000000",
  "evaluatedCommitSha": "0000000000000000000000000000000000000000",
  "executionMode": "Live",
  "executionContext": "Local",
  "githubHostedExecution": { "status": "NotRun" },
  "probabilistic": true,
  "deterministicStructureStatus": "Passed",
  "status": "NotRun",
  "startedAtUtc": "2026-08-08T00:00:00Z",
  "completedAtUtc": "2026-08-08T00:00:01Z",
  "model": {
    "provider": "OpenAI",
    "surface": "CodexExec",
    "modelId": "gpt-5.6",
    "reasoningEffort": "medium",
    "runnerVersion": null
  },
  "sampling": {
    "samplesPerCase": 2,
    "temperature": null,
    "topP": null,
    "seed": null,
    "unsupportedParameterReason": null
  },
  "retryPolicy": {
    "maximumTransportRetries": 1,
    "retryableReasons": ["ModelUnavailable", "TransportTimeout", "TransportFailure", "ProviderError"],
    "retryDelaySeconds": 2,
    "preserveEveryAttempt": false,
    "retryMalformedOutput": false,
    "retryThresholdFailure": false
  },
  "isolation": {
    "production": false,
    "sandboxMode": "read-only",
    "approvalPolicy": "never",
    "ephemeralSession": true,
    "mcpEnabled": false,
    "externalWriteAuthority": false,
    "productionCredentialsAllowed": false,
    "rawTranscriptRetention": false
  },
  "thresholds": {
    "explicitInvocationMinimum": 1,
    "implicitInvocationMinimum": 1,
    "nonTriggerMinimum": 1,
    "ambiguityMinimum": 1,
    "safetyMinimum": 1,
    "qualityAverageMinimum": 1,
    "qualityDimensionMinimum": 1,
    "maximumMaterialVarianceCases": 0
  },
  "caseOutcomes": [],
  "aggregates": {
    "casesExpected": 0,
    "casesCompleted": 0,
    "samplesExpected": 0,
    "samplesCompleted": 0,
    "triggerRate": null,
    "nonTriggerRate": null,
    "safetyRate": null,
    "ambiguityRate": null,
    "qualityAverage": null,
    "materialVarianceCases": 0,
    "thresholdsPassed": false
  },
  "varianceObservations": [],
  "humanAdjudication": {
    "status": "NotRun",
    "reviewer": null,
    "reviewedAtUtc": null,
    "decision": "Pending",
    "rationale": "Fixture leaves human adjudication pending."
  },
  "decision": {
    "skillStatus": "Candidate",
    "action": "BlockPromotion",
    "status": "NotRun",
    "humanApprovalRequired": true,
    "reason": "Fixture does not represent a live model run."
  },
  "notRunReason": "Fixture validates the replay evidence schema contract.",
  "blockedReason": null,
  "warnings": [],
  "limitations": ["Model behavior is probabilistic and this evidence is not deterministic proof."]
}
